<?xml version='1.0' encoding="UTF-8" ?>

<users xmlns:xsi="http://www.w3.org/2001/XMLSchema-instance"
       xmlns="http://www.itcast.cn/xml"
       xsi:schemaLocation="http://www.itcast.cn/xml user.xsd">

    <user>
        <id>1</id>
        <name>张三</name>
        <age>34</age>
        <gender>female</gender>
        <salary>3000</salary>
    </user>
    <user>
        <id>2</id>
        <name>张三</name>
        <age>21</age>
        <gender>male</gender>
        <salary>4000</salary>
    </user>
    <user>
        <id>3</id>
        <name>王五</name>
        <age>46</age>
        <gender>male</gender>
        <salary>6500</salary>
    </user>
    <user>
        <id>4</id>
        <name>赵六</name>
        <age>28</age>
        <gender>female</gender>
        <salary>4400</salary>
    </user>
    <user>
        <id>5</id>
        <name>钱七</name>
        <age>15</age>
        <gender>male</gender>
        <salary>12000</salary>
    </user>
</users>